<!ELEMENT board_setup (piece+, target)>

<!ELEMENT piece (type, line, col, (white|black))>
<!ELEMENT type (#PCDATA)>
<!ELEMENT line (#PCDATA)>
<!ELEMENT col (#PCDATA)>
<!ELEMENT white EMPTY>
<!ELEMENT black EMPTY>

<!ELEMENT target (#PCDATA)>

<!ATTLIST piece id ID #REQUIRED>
